{
 "instructions": [
  {
   "id": "instruction:agent_instructions.AGENT_BACKSTORY",
   "kind": "system_fragment",
   "source": {
    "path": "agent_instructions.py",
    "symbol": "AGENT_BACKSTORY",
    "start_line": 24,
    "end_line": 232
   },
   "excerpt": "GENERAL UNCLEAR-INTENT POLICY -- ASSUME, ANSWER, OFFER REFINEMENT. Apply this on every turn, whether or not a pre-fetched inventory is available. A missing detail is material on...",
   "definition_sha256": "d8d61711bbdbcba6c1147e9e26a7eee31bb3272efd02e8fce227aac060de1dbf",
   "used_by": [
    "agent_instructions.AGENTS_YAML",
    "agent_instructions.build_system_prompt"
   ],
   "delivered_via": "system_message",
   "condition": "Always: composed once at import into SYSTEM_PROMPT_TEXT and sent on every model call. Placeholders resolved from SCOPE_REF, not run ids.",
   "semantic": {
    "summary": "The main behavioural policy: unclear-intent handling, tool routing, scope moves, and retrieval discipline.",
    "facets": [
     {
      "label": "benchmarking",
      "confidence": "explicit",
      "basis": [
       "source_text"
      ]
     },
     {
      "label": "cross-survey-analysis",
      "confidence": "explicit",
      "basis": [
       "source_text"
      ]
     },
     {
      "label": "result-formatting",
      "confidence": "explicit",
      "basis": [
       "source_text"
      ]
     },
     {
      "label": "scope-enforcement",
      "confidence": "explicit",
      "basis": [
       "source_text"
      ]
     },
     {
      "label": "sql-generation",
      "confidence": "explicit",
      "basis": [
       "source_text"
      ]
     },
     {
      "label": "statistical-testing",
      "confidence": "explicit",
      "basis": [
       "source_text"
      ]
     },
     {
      "label": "survey-analysis-packet",
      "confidence": "explicit",
      "basis": [
       "source_text"
      ]
     },
     {
      "label": "word-cloud",
      "confidence": "explicit",
      "basis": [
       "source_text"
      ]
     }
    ],
    "workflow_ids": [
     "workflow:scope-authorization",
     "workflow:sql-retrieval",
     "workflow:startup-inventory",
     "workflow:survey-benchmarking"
    ],
    "workflow_roles": [
     {
      "workflow_id": "workflow:scope-authorization",
      "role": "intent-and-routing-policy",
      "strength": "core",
      "confidence": "explicit",
      "basis": [
       "source_text"
      ]
     },
     {
      "workflow_id": "workflow:sql-retrieval",
      "role": "intent-and-routing-policy",
      "strength": "core",
      "confidence": "explicit",
      "basis": [
       "source_text"
      ]
     },
     {
      "workflow_id": "workflow:startup-inventory",
      "role": "inventory-usage-policy",
      "strength": "supporting",
      "confidence": "explicit",
      "basis": [
       "source_text"
      ]
     },
     {
      "workflow_id": "workflow:survey-benchmarking",
      "role": "intent-and-routing-policy",
      "strength": "core",
      "confidence": "explicit",
      "basis": [
       "source_text"
      ]
     }
    ]
   }
  },
  {
   "id": "instruction:agent_instructions.AGENT_GOAL",
   "kind": "system_fragment",
   "source": {
    "path": "agent_instructions.py",
    "symbol": "AGENT_GOAL",
    "start_line": 21,
    "end_line": 22
   },
   "excerpt": "Answer what the user asks about client_id {client_id}. Treat survey_id {survey_id} as the default scope: an ordinary question stays in that survey and does not search neighborin...",
   "definition_sha256": "dbbc511f4b1e7ce62559b90f60b175417f4245e8d27d9fa8ee122c22f14c5986",
   "used_by": [
    "agent_instructions.AGENTS_YAML",
    "agent_instructions.build_system_prompt"
   ],
   "delivered_via": "system_message",
   "condition": "Always: composed once at import into SYSTEM_PROMPT_TEXT and sent on every model call. Placeholders resolved from SCOPE_REF, not run ids.",
   "semantic": {
    "summary": "Sets default single-survey scope, the client-isolation rule, and the one assigned-benchmark exception.",
    "facets": [
     {
      "label": "benchmarking",
      "confidence": "explicit",
      "basis": [
       "source_text"
      ]
     },
     {
      "label": "cross-survey-analysis",
      "confidence": "explicit",
      "basis": [
       "source_text"
      ]
     },
     {
      "label": "scope-enforcement",
      "confidence": "explicit",
      "basis": [
       "source_text"
      ]
     },
     {
      "label": "survey-analysis-packet",
      "confidence": "explicit",
      "basis": [
       "source_text"
      ]
     }
    ],
    "workflow_ids": [
     "workflow:scope-authorization",
     "workflow:survey-benchmarking"
    ],
    "workflow_roles": [
     {
      "workflow_id": "workflow:scope-authorization",
      "role": "scope-boundary-rule",
      "strength": "core",
      "confidence": "explicit",
      "basis": [
       "source_text"
      ]
     },
     {
      "workflow_id": "workflow:survey-benchmarking",
      "role": "benchmark-exception-rule",
      "strength": "core",
      "confidence": "explicit",
      "basis": [
       "source_text"
      ]
     }
    ]
   }
  },
  {
   "id": "instruction:agent_instructions.AGENT_ROLE",
   "kind": "system_fragment",
   "source": {
    "path": "agent_instructions.py",
    "symbol": "AGENT_ROLE",
    "start_line": 18,
    "end_line": 19
   },
   "excerpt": "Current Survey Analyst",
   "definition_sha256": "6c795af4adeb06546b504837c2faefa7ae423c32538122823375e07ee61c4dbb",
   "used_by": [
    "agent_instructions.AGENTS_YAML",
    "agent_instructions.build_system_prompt"
   ],
   "delivered_via": "system_message",
   "condition": "Always: composed once at import into SYSTEM_PROMPT_TEXT and sent on every model call.",
   "semantic": {
    "summary": "Names the agent to the model as the Current Survey Analyst; opens the system prompt.",
    "facets": [
     {
      "label": "agent-identity",
      "confidence": "explicit",
      "basis": [
       "source_text"
      ]
     }
    ],
    "workflow_ids": [
     "workflow:answer-formatting"
    ],
    "workflow_roles": [
     {
      "workflow_id": "workflow:answer-formatting",
      "role": "agent-identity-header",
      "strength": "adjacent",
      "confidence": "explicit",
      "basis": [
       "source_text"
      ]
     }
    ]
   }
  },
  {
   "id": "instruction:agent_instructions.CLUSTER_RULES",
   "kind": "system_fragment",
   "source": {
    "path": "agent_instructions.py",
    "symbol": "CLUSTER_RULES",
    "start_line": 1717,
    "end_line": 1800
   },
   "excerpt": "RESPONDENT CLUSTERS -- and only these. When cluster_rating_profiles returns, render its payload and add nothing the tool did not compute. Open with one line naming the basis: ho...",
   "definition_sha256": "0c2ed46555704576719efc5ad184fd1ef20d256bf98303ade147a651f6a23f80",
   "used_by": [
    "agent_instructions.build_system_prompt"
   ],
   "delivered_via": "system_message",
   "condition": "Always: composed once at import into SYSTEM_PROMPT_TEXT and sent on every model call. Appended to EXPECTED_OUTPUT inside the final-answer section, after PLSR_RULES.",
   "semantic": {
    "summary": "Renders cluster_rating_profiles: a fixed six-column table, names from defining attributes, k/stability disclosure, no significance.",
    "facets": [
     {
      "label": "output-form-guardrail",
      "confidence": "explicit",
      "basis": [
       "source_text"
      ]
     },
     {
      "label": "persona-synthesis",
      "confidence": "explicit",
      "basis": [
       "source_text"
      ]
     },
     {
      "label": "respondent-clustering",
      "confidence": "explicit",
      "basis": [
       "source_text"
      ]
     },
     {
      "label": "result-formatting",
      "confidence": "explicit",
      "basis": [
       "source_text"
      ]
     }
    ],
    "workflow_ids": [
     "workflow:answer-formatting",
     "workflow:persona-generation",
     "workflow:respondent-clustering"
    ],
    "workflow_roles": [
     {
      "workflow_id": "workflow:answer-formatting",
      "role": "cluster-output-contract",
      "strength": "supporting",
      "confidence": "explicit",
      "basis": [
       "source_text"
      ]
     },
     {
      "workflow_id": "workflow:persona-generation",
      "role": "cluster-persona-separation",
      "strength": "supporting",
      "confidence": "explicit",
      "basis": [
       "source_text"
      ]
     },
     {
      "workflow_id": "workflow:respondent-clustering",
      "role": "cluster-output-contract",
      "strength": "core",
      "confidence": "explicit",
      "basis": [
       "source_text"
      ]
     }
    ]
   }
  },
  {
   "id": "instruction:agent_instructions.EXPECTED_OUTPUT",
   "kind": "system_fragment",
   "source": {
    "path": "agent_instructions.py",
    "symbol": "EXPECTED_OUTPUT",
    "start_line": 237,
    "end_line": 369
   },
   "excerpt": "Give answer based on the tool call outputs. Report the sample size (N) alongside any statistic. If a correlation, comparison, or test is not statistically significant (or N is s...",
   "definition_sha256": "a8aba63af34a0ef1650ff9134516b3a725c801a0c5b57efe54bcb86741d5ede0",
   "used_by": [
    "agent_instructions.TASKS_YAML",
    "agent_instructions.build_system_prompt"
   ],
   "delivered_via": "system_message",
   "condition": "Always: composed once at import into SYSTEM_PROMPT_TEXT and sent on every model call. Read from TASK_CONFIG['expected_output']; heads the final-answer section.",
   "semantic": {
    "summary": "Final-answer contract: report N, flag non-significance, hide UUIDs, refuse program text, and allow only the two defined fences plus a shaped gpi-chart payload.",
    "facets": [
     {
      "label": "chart-rendering",
      "confidence": "explicit",
      "basis": [
       "source_text"
      ]
     },
     {
      "label": "output-form-guardrail",
      "confidence": "explicit",
      "basis": [
       "source_text"
      ]
     },
     {